[
  {
    "census_id": "TX-62-4408",
    "confidence": "cross-validated",
    "property": {
      "name": "Avaya Kingwood",
      "aka": [
        "Virtual Living at Kingwood",
        "Northpark Reserve (MCAD legal-description AKA)"
      ],
      "address": "25710 Loop 494",
      "city": "Kingwood",
      "county": "Montgomery",
      "zip": "77339",
      "cad_account": "0004050100903",
      "units": null,
      "year_built": 2014,
      "status": "Completed"
    },
    "sponsor": {
      "name": "Houston Housing Authority",
      "species": "HA",
      "statute": "Ch.392",
      "home_jurisdiction": "Houston",
      "home_county": "Harris",
      "role_on_property": "Additional owner"
    },
    "partners": [
      "Catalyst Equity Partners"
    ],
    "classification": {
      "tier": 3,
      "traveling": "yes",
      "structure_confirmed": "fee-flip-groundlease",
      "affordability_source": "none (seed-labeled 'None'; property markets as conventional/market-rate under Asset Living management per public listings)",
      "in_target_set": true
    },
    "structure_dates": {
      "mou_date": null,
      "swd_to_sponsor_date": null,
      "ground_lease_date": null,
      "ground_lease_term_years": 99,
      "recording_refs": [
        "A0405 - OWEN MARY, TRACT 9-D (AKA NORTHPARK RESERVE #2014057509), ACRES 12.83"
      ],
      "recording_batch_note": "Seed: 'In 04/25 the property was recapitalized with an unrecorded sale that added Houston Housing Authority to the ownership group. The 04/22 sale price is unconfirmed.' Ground lease per seed expires 05/01/2124 (99-yr, unsubordinated net)."
    },
    "exemption": {
      "first_exempt_tax_year": 2025,
      "appraised_value": 34400000.0,
      "annual_exemption_value_est": 847579.07,
      "taxing_units": 7
    },
    "covenant": {
      "set_aside_pct": null,
      "ami_band": null,
      "meets_hb21_formula": null
    },
    "kill_analysis": {
      "regime": "HA-specific (Ch.392 Sec.392.005) -- NO statutory 2027 cliff (HB21/HB2071 do not reach Ch.392)",
      "captured_9_1_2025": false,
      "host_resolutions_adopted": null,
      "audit_filed_tdhca": "unknown",
      "recent_capital_event": "2025-04 recapitalization added HHA to ownership group (seed sale_comment; unrecorded sale)",
      "kill_date_estimate": null,
      "kill_date_basis": "No statutory cliff; unwind only via ultra vires challenge, Sec.392.005(c) affordability-condition dispute, or litigation (event-driven, per Phase-1 verdict)."
    },
    "loan": {
      "lender_or_servicer": null,
      "securitization": null,
      "maturity": null,
      "distress_flag": null,
      "note": "Not researched -- out of reach of free CAD/tax-office/court sources this pass."
    },
    "litigation_flags": [],
    "instrument_extractions": [],
    "gaps": [
      "units count not found in free MCAD/ACT sources (neither publishes unit counts); third-party listing sites did not return a confirmed unit count for this specific address.",
      "PRORATED-EXXV exemption code (Montgomery Co. Tax Office jurisdiction detail) indicates the exemption began partway through TY2025; exact effective date not published -- only the tax year is confirmable from this free source.",
      "annual_exemption_value_est is a modeled estimate: (current taxable-portion levy) x (exempt value / taxable value), using actweb.acttax.com's 2025 jurisdiction table; not an official TDHCA/CAD-published foregone-tax figure."
    ],
    "provenance": [
      {
        "field": "property.address/cad_account/legalDescription/year_built",
        "source": "MCAD Tax Parcel View (ArcGIS FeatureServer, services1.arcgis.com/PRoAPGnMSUqvTrzq/arcgis/rest/services/Tax_Parcel_view/FeatureServer/0), free public GIS layer sourced from Montgomery CAD",
        "retrieved": "2026-07-11",
        "note": "pid 432360, pYear 2026; ownerName=HOUSTON HOUSING AUTHORITY"
      },
      {
        "field": "property.name (aka)",
        "source": "WebSearch: usdoh.org, avayakingwood.com, apartments.com listings for 25710 Loop 494 / TX-494 Loop, Kingwood/Porter TX",
        "retrieved": "2026-07-11",
        "note": "Also listed as 'Virtual Living at Kingwood'"
      },
      {
        "field": "exemption.appraised_value/taxing_units/exemption code",
        "source": "Montgomery County Tax Office (Appraisal & Collection Technologies) actweb.acttax.com/act_webdev/montgomery -- free public owner-name search + account detail + jurisdiction/exemption breakdown (Account 0004050100903, CAD Ref R432360)",
        "retrieved": "2026-07-11",
        "note": "Gross Value $34,400,000; Exemptions: PRORATED-EXXV; Current Tax Levy $302,481.74 (jurisdiction detail: 7 taxing units)"
      },
      {
        "field": "exemption.first_exempt_tax_year",
        "source": "Montgomery County Tax Office (Appraisal & Collection Technologies) actweb.acttax.com/act_webdev/montgomery -- free public owner-name search + account detail + jurisdiction/exemption breakdown",
        "retrieved": "2026-07-11",
        "note": "Inferred from 'PRORATED-EXXV' flag on the TY2025 jurisdiction table (prorated = exemption began during the tax year)"
      },
      {
        "field": "sponsor/tier/kill_regime",
        "source": "data/sponsors.json (PHASE1_VERIFIED, Houston Housing Authority)",
        "retrieved": "2026-07-11",
        "note": null
      },
      {
        "field": "census_id/role/partners/ground_lease_comment/sale_comment",
        "source": "data/seed_properties.json (market_id 62, property_id 4408)",
        "retrieved": "2026-07-11",
        "note": null
      }
    ]
  },
  {
    "census_id": "TX-62-940094",
    "confidence": "seed",
    "property": {
      "name": null,
      "aka": [],
      "address": null,
      "city": "Spring",
      "county": "Montgomery",
      "zip": null,
      "cad_account": null,
      "units": null,
      "year_built": null,
      "status": "Completed"
    },
    "sponsor": {
      "name": "Houston Housing Authority",
      "species": "HA",
      "statute": "Ch.392",
      "home_jurisdiction": "Houston",
      "home_county": "Harris",
      "role_on_property": "Ground Leasor"
    },
    "partners": [
      "Civitas Capital Group"
    ],
    "classification": {
      "tier": 3,
      "traveling": "yes",
      "structure_confirmed": "unconfirmed",
      "affordability_source": "structure (seed-labeled 'Partial')",
      "in_target_set": true
    },
    "structure_dates": {
      "mou_date": null,
      "swd_to_sponsor_date": null,
      "ground_lease_date": null,
      "ground_lease_term_years": 99,
      "recording_refs": [],
      "recording_batch_note": "Seed: 99-yr unsubordinated net ground lease held by Houston Housing Authority, expires 06/08/2122."
    },
    "exemption": {
      "first_exempt_tax_year": null,
      "appraised_value": null,
      "annual_exemption_value_est": null,
      "taxing_units": null
    },
    "covenant": {
      "set_aside_pct": null,
      "ami_band": null,
      "meets_hb21_formula": null
    },
    "kill_analysis": {
      "regime": "HA-specific (Ch.392) -- no statutory 2027 cliff",
      "captured_9_1_2025": false,
      "host_resolutions_adopted": null,
      "audit_filed_tdhca": "unknown",
      "recent_capital_event": null,
      "kill_date_estimate": null,
      "kill_date_basis": "No statutory cliff (Ch.392); event-driven only."
    },
    "loan": {
      "lender_or_servicer": null,
      "securitization": null,
      "maturity": null,
      "distress_flag": null,
      "note": "Not researched."
    },
    "litigation_flags": [],
    "instrument_extractions": [],
    "gaps": [
      "NOT FOUND in Montgomery free sources this pass: an 'HOUSTON HOUSING AUTHORITY' owner-name search on the Montgomery County Tax Office (actweb.acttax.com) returned exactly 1 match statewide-prefix (the Kingwood/Avaya account, TX-62-4408) -- no second HHA-owned account exists on Montgomery's certified roll. MCAD's Tax_Parcel_view GIS layer sweep (owner LIKE '%HOUSING AUTHORITY%') likewise returned only the Kingwood parcel plus the unrelated local Montgomery County Housing Authority.",
      "Spring, TX addresses commonly straddle the Harris/Montgomery county line; this parcel may in fact be sited in Harris County despite the seed's 'Montgomery' county tag, or the ground-lease deal may not have resulted in a Montgomery-recorded fee-title change under the Houston Housing Authority name. Could not be resolved from Montgomery-county free sources -- would need a Harris County (HCAD) cross-check or Method 3 (county clerk deed search) to confirm or rule out.",
      "No CAD account, address, appraised value, or exemption status could be sourced -- record retained at seed level only."
    ],
    "provenance": [
      {
        "field": "all base fields",
        "source": "data/seed_properties.json (market_id 62, property_id 940094)",
        "retrieved": "2026-07-11",
        "note": null
      },
      {
        "field": "negative-match search",
        "source": "Montgomery County Tax Office (Appraisal & Collection Technologies) actweb.acttax.com/act_webdev/montgomery -- free public owner-name search + account detail + jurisdiction/exemption breakdown (owner-name prefix search 'HOUSTON HOUSING AUTHORITY')",
        "retrieved": "2026-07-11",
        "note": "1 matches total statewide-prefix -- Kingwood only"
      },
      {
        "field": "negative-match search",
        "source": "MCAD Tax Parcel View (ArcGIS FeatureServer, services1.arcgis.com/PRoAPGnMSUqvTrzq/arcgis/rest/services/Tax_Parcel_view/FeatureServer/0), free public GIS layer sourced from Montgomery CAD",
        "retrieved": "2026-07-11",
        "note": "county-wide ownerName sweep for HOUSING AUTHORITY/HOUSING FINANCE/PUBLIC FACILITY found only 1 Houston HA parcel (Kingwood)"
      }
    ]
  },
  {
    "census_id": "TX-63-3939",
    "confidence": "single-source",
    "property": {
      "name": "Grove at Sterling Ridge",
      "aka": [